id,title,rating
14983,Pumpkin Seed Pesto ,3.75
14984,Apricot Pear Cordials ,5.0
14985,Maple Crème Caramel ,5.0
14986,Radish and Chive Salad ,4.375
14987,Vegetables Glazed with Balsamic Vinegar ,3.75
14988,Chicken Laap ,4.375
14989,Grilled Chicken and Vegetable Sandwiches with Tarragon Mayonnaise ,4.375
14990,Grilled Vegetable Salad with Tofu ,0.0
14991,Mesa Barbecue Sauce ,5.0
14992,"Spaghetti with Pepperoni, Peas, and Browned Onions ",3.125
14993,Turtle Bars ,3.75
14994,Pasta with Butternut Squash and Spinach ,3.75
14995,Pastry Dough ,5.0
14996,Goose Stew with Barley and Celery Root ,5.0
14997,Grilled Pork Chops with Anise-Seed Rub and Mango Mojo ,4.375
14998,Curried Sweet Potato Soup ,4.375
14999,Spicy Pickled Green Beans and Fennel ,0.0
15000,Celery Root Soup ,2.5
15001,Peanut Butter Cheesecake with Peanut Brittle ,3.75
15002,Our Favorite Pie Dough ,3.75
15003,Seared Shrimp with Warm New Potato Salad ,3.125
15004,Blueberry Lemon Crumbles ,4.375
15005,Chocolate-Chicory Sauce ,2.5
15006,Marscarpone Cream ,5.0
15007,"Crispy Za'atar Fish with Israeli Couscous, Swiss Chard, and Feta ",4.375
15008,Anchovies in Tomato Sauce with Pasta ,3.75
15009,Kaffir Lime Mousse with Honeydew Water ,5.0
15010,Pesto ,4.375
15011,Fresh Tomato and Onion Chutney ,3.75
15012,Cider-Brined Pork Roast with Potatoes and Onions ,4.375
15013,Chile Glaze ,4.375
15014,Coconut Milk Whipped Cream ,1.875
15015,Honey-Cardamom Custards with Strawberry-Orange Compote ,5.0
15016,Blueberry Lemon Corn Muffins ,3.75
15017,Black Bean Ancho Chili ,4.375
15018,Baked Hawaiian Islands ,3.125
15019,"Louisiana Mussel ""Sauce Piquante"" with Garlic Bread ",4.375
15020,Spice Cupcakes with Cream-Cheese Icing ,3.125
15021,Herbed-Cheese and Zucchini Omelet ,3.75
15022,Hawaiian ,0.0
15023,Shaved Asparagus with Parmesan Vinaigrette ,4.375
15024,Turkey Gravy ,3.75
15025,Carrot and Radish Salad ,2.5
15026,Chicken and Mashed Potatoes with Herb-Roasted Tomatoes and Olive Broth ,4.375
15027,Grilled Portobello Burgers with Piquillo Pepper Aïoli and Watercress ,5.0
15028,Peppercorn Steaks with Bourbon Sauce ,4.375
15029,Pork Kebabs al Pastor ,3.125
15030,Croutes au Fromage ,4.375
15031,"Tomato, Red Onion, and Basil Bruschetta ",5.0
15032,Vegetable Stock ,4.375
15033,Apple and Celery Salad with Peanuts ,3.75
15034,Tart Shell ,4.375
15035,Black Olive Aïoli ,1.25
15036,"Pumpkin Pie ""pumpkin"" ",3.125
15037,Herb and Bacon Corn-Bread Stuffing ,4.375
15038,Corn Bread ,3.75
15039,Turkey Giblet Stock ,3.75
15040,Herbed Lima Bean Hummus ,4.375
15041,Cornmeal Harvest Loaves ,3.75
15042,"Potato and Roasted Garlic Soup with Wheat Berry, Watercress, and Endive Salad ",3.125
15043,Beef and Shrimp Kebabs ,3.75
15044,Grilled Chicken with Peach and Apple Salsa ,4.375
15045,"Root Vegetable ""Lasagna"" with Mushroom Broth ",3.125
15046,Apple Cider Vinaigrette ,3.75
15047,Lamb Chops with Cherry Balsamic Sauce and Mint ,4.375
15048,Veal Demi-Glacé ,4.375
15049,Roasted Red Curry Chicken with Apple Jus ,3.75
15050,"Sauteed Turbot with Braised Endive, Celery Root Flan, Black Truffles, and Garlic Nage ",4.375
15051,Celery Root Bisque with Thyme Croutons ,4.375
15052,Sweet-Potato Salad with Mustard Viniagrette ,4.375
15053,Cream Puffs with Vanilla Ice Cream and Chocolate Sauce ,5.0
15054,Grapefruit Tart ,4.375
15055,Strawberry Coconut Pineapple Shake ,5.0
15056,Chicken with Coconut Curry Sauce ,3.75
15057,Vegetable and Chicken Curry ,4.375
15058,Spicy Dill Pickles ,4.375
15059,Tangy Avocado-Orange Salad ,3.75
15060,Cumin-Crusted Monster Pork Chop with Peach Chipotle Salsa ,4.375
15061,Umeboshi and Rice Salad with Pickled Ginger and Sugar Snap Peas ,3.125
15062,Confit Cherry Tomatoes ,0.0
15063,Broiled Salmon with Apple-Date Chutney ,4.375
15064,Layered Chicken Enchiladas with Tomatillo-Cilantro Sauce ,4.375
15065,Chocolate Sauce ,5.0
15066,"Persian New Year's Soup with Beans, Noodles, and Herbs (Ash-e-reshteh) ",3.75
15067,Chocolate Hazelnut Pound Cake with Chocolate Glaze ,3.75
15068,Vanilla Cream ,3.75
15069,Fresh Tomato Salsa ,3.75
15070,Grilled Mango ,3.125
15071,Rhubarb and Ricotta Cheese Puff-Pastry Tartlets ,4.375
15072,"Potato Latkes with Smoked Salmon, Caviar, and Tarragon Crème Fraîche ",5.0
15073,Mexican Clam Dip ,4.375
15074,Herbed Cream Cheese Cucumber Rounds ,4.375
15075,Curried Spinach Soup with Yogurt and Cilantro ,3.75
15076,Rosemary Lamb Chops with Breadcrumbs ,4.375
15077,Crab Cakes with Green Onion and Dill ,3.125
15078,Rice with Julienned Carrots ,3.75
15079,Turkey Giblet Stock ,5.0
15080,Salmon Platter with Caper Dressing ,3.75
15081,Drunken Raspberries ,4.375
15082,Quick Paella ,3.125
15083,Roast Chicken with Rosemary-Orange Butter ,4.375
15084,Honeyed Walnut Tart ,5.0
15085,Parmesan Sauce ,2.5
15086,Parmesan Polenta Squares ,3.75
15087,Snapper with Tapenade and Radish and Chive Salad ,3.75
15088,Choucroute with Caramelized Pears ,2.5
15089,Bake-Salé Lemon Meringue Pie ,3.75
15090,Udon Noodle Salad with Grilled Chicken and Coriander Dressing ,3.75
15091,Zeppole ,3.125
15092,Potato and Portobello Mushroom Gratin ,3.75
15093,Eggs with Pickled Shallot and Parsley ,0.0
15094,Beurre Blanc ,5.0
15095,Red-Wine Braised Rabbit with Sage Polenta ,4.375
15096,Lebanese Lamb and Bean Stew ,4.375
15097,Corn Bread Panzanella ,3.75
15098,"Red Snapper with Cilantro, Garlic, and Lime ",3.75
15099,Herbed Goat Cheese Tart ,4.375
15100,Royal Blueberry Ice Pops ,3.125
15101,Rustic Green Pepper and Olive Pan Pizza ,3.125
15102,Sloe Gin Spritz ,0.0
15103,Spring Pea And Pea Shoot Omelet ,2.5
15104,Spaghetti with Green Chili-Pine Nut Meatballs ,4.375
15105,Seared Foie Gras and Lingonberry Jam on Brioche Toast ,3.75
15106,Traditional Napa Cabbage Kimchi ,3.75
15107,Yogurt Panna Cotta with Cherry and Peach Compote ,4.375
15108,Italian Vegetable Stew (Ciambotta) ,4.375
15109,Pacific Salmon with Roasted Garlic ,4.375
15110,Butternut Squash Soup with Star Anise and Ginger Shrimp ,4.375
15111,"Watermelon, Green Onion, and Mint Salad ",4.375
15112,Tostadas with Creamy Roasted Poblanos and Corn ,4.375
15113,Pumpkin Pie with Brown Sugar-Walnut Topping ,4.375
15114,Orange Blossom Cheesecake with Raspberry and Pomegranate Sauce ,4.375
15115,Sesame Beef and Snow Pea Soup ,3.75
15116,Tuna Kebabs with Ginger-Chile Marinade ,5.0
15117,Apple and Blackberry Pie ,4.375
15118,Caramelized Upside-Down Pear Tart ,4.375
15119,Spicy Crab Spaghettini with Preserved Lemon ,3.75
15120,Rum Punch with Passion Fruit and Lime ,5.0
15121,Danish Pastry Braid ,5.0
15122,Classic Spinach-Artichoke Dip with Mozzarella and Parmesan ,4.375
15123,"Raspberry, Rhubarb and Pear Pies ",4.375
15124,Buttermilk Pie Crust Dough ,5.0
15125,"""Opulent"" Chicken ",3.75
15126,"Shrimp, Vegetable and Cashew Stir-Fry ",3.75
15127,Parmesan Pepper Curly Kale Chips ,4.375
15128,"Creamy Phyllo, Raisin and Nut Pudding ",4.375
15129,Cabbage and Tomato Slaw with Sherry-Mustard Viniagrette ,3.75
15130,Maple Apple Pandowdy with Dried Cranberries ,4.375
15131,Grilled Striped Bass with Lemon and Fennel ,4.375
15132,Zucchini Pancakes with Basil Chive Cream ,3.75
15133,Gumbo Z'herbes with Perfect Rice ,4.375
15134,Pears Poached in Earl Grey Tea with Dried Fruit ,3.75
15135,Farfalle with Tomatoes and Feta Cheese ,4.375
15136,Asian-Style Crab and Shrimp Cakes ,3.75
15137,Purple Potatoes with Sour Cream and Caviar ,2.5
15138,Chestnut Risotto with Butternut Squash ,3.75
15139,Yam and Black Bean Burritos with Amaranth ,5.0
15140,Berry Toast Cups ,5.0
15141,Pastry Dough ,4.375
15142,Mahón Cheese Ice Cream ,5.0
15143,"Puff Pastry Turnovers with Shrimp, Scallops and Spinach ",4.375
15144,Glazed Blueberry-Blackberry Turnovers ,5.0
15145,Louisiana Jambalaya ,4.375
15146,Cauliflower Risotto with Brie and Almonds ,3.75
15147,"Jasmine Rice with Garlic, Ginger, and Cilantro ",4.375
15148,Ginger Garlic Green Beans ,4.375
15149,"Shaved Fennel, Radish, and Grapefruit Salad ",2.5
15150,Cilantro Garlic Yogurt Sauce ,3.75
15151,Miso-Glazed Black Cod on Sunflower Sprouts ,4.375
15152,Mustard and Dill Vinaigrette ,2.5
15153,Fish Stock ,0.0
15154,"Prosciutto, Goat Cheese, and Fig Sandwiches ",3.75
15155,Chicken and Artichoke Stew ,4.375
15156,Vegetable Soup with Basil and Garlic ,3.125
15157,"Mint-Marinated Shrimp with Tabbouleh, Tomatoes, and Feta ",4.375
15158,Orange-Pineapple Carrot Cake ,4.375
15159,Curried Peanut Soup ,4.375
15160,Salt-Encrusted Beef Tenderloin ,4.375
15161,Grilled Skewered Scallops and Apricots with Honey-Mustard Dressing ,3.75
15162,Poblano Cream Soup ,3.125
15163,Scalloped Potatoes with Blue Cheese and Turnips ,3.75
15164,Green Curry With Brown Rice Noodles and Swiss Chard ,0.0
15165,"Cabbage Packages Filled with Creamed Onions, Bacon and Sage ",3.75
15166,"Sausage and White Bean ""Cassoulet"" ",3.75
15167,Asparagus and Leek Risotto with Prosciutto ,4.375
15168,Blueberry Compote ,5.0
15169,Pan-Roasted Carrots with Miso-Butter ,5.0
15170,Baja Fish Tacos ,4.375
15171,"Grilled Swiss Cheese, Tuna and Red Pepper Sandwiches ",3.75
15172,Miso Glazed Sea Bass ,4.375
15173,Hot and Sweet Mango Salsa ,3.75
15174,"Seared Halibut with Haricots Verts, Scallions, and White Wine Sauce ",5.0
15175,Watercress Salad With Warm Mustard Dressing ,5.0
15176,Ham and Horseradish Stuffed Eggs ,4.375
15177,Lemon Meringue Ice Cream Pie in Toasted Pecan Crust ,5.0
15178,Ginger-Lime Coconut Cake with Marshmallow Frosting ,3.75
15179,Braised Escarole with Currants and Pine Nuts ,3.75
15180,Fiorentini with Butternut Squash ,3.125
15181,Cream of Jerusalem Artichoke and Celery Soup ,2.5
15182,Fresh Vegetable Platter with Olive Oil Dip ,3.75
15183,Winter Salad with Toasted Mustard Seed Vinaigrette ,1.25
15184,Satan's Circus ,3.75
15185,Asparagus Roast Beef Roll-Ups ,5.0
15186,"Red Snapper with Thyme, Tomatoes, and Olives ",3.75
15187,Alt-Grain Porridge With Sausages and Grapes ,0.0
15188,Mexican Pineapple Salad ,4.375
15189,Tom and Jerry ,0.0
15190,Mustard Scallion Potato Salad ,3.75
15191,Sautéed Savoy Cabbage with Scallions and Garlic ,3.125
15192,Crab & Sweet Corn Cakes ,3.125
15193,Chocolate Velvet Ice Cream ,4.375
15194,Ham Mousse in Sherry Aspic ,3.75
15195,Sausage-Stuffed Rack of Pork with Sage ,5.0
15196,Dilly Bean Potato Salad ,4.375
15197,Fresh Pasta With Clams And Hot Italian Sausage ,4.375
15198,Spring Greens Sauté with Bacon and Walnuts ,2.5
15199,Radicchio Salad With Caramelized Carrots and Onions ,4.375
15200,Sauteed Swiss Chard with Onions ,4.375
15201,Orange-Flower Pavlovas with Strawberries ,4.375
15202,Grilled Sausages with Figs and Mixed Greens ,4.375
15203,Roasted Sweet Potatoes with Honey Glaze ,4.375
15204,Honey Apple Pie with Orange Lattice Crust ,4.375
15205,"Game Hens with Honey, Vinegar and Spice Glaze ",3.75
15206,Sweet and Sour Pork ,3.125
15207,Lentil Stew with Spinach and Potatoes ,4.375
15208,Pistachio-Crusted Scallops ,4.375
15209,Bucatini All'Amatriciana ,4.375
15210,Dill-Pickled Vegetables ,5.0
15211,Applesauce Cake with Penuche Frosting ,2.5
15212,"Red Onion, Parsley, and Preserved Lemon Salad ",4.375
15213,Filets Mignons with Mustard Port Sauce with Red Onion Confit ,4.375
15214,Fast Favorite Garlic Dill Pickles ,4.375
15215,Dilled Spinach Crepes with Avgolemono Sauce ,3.75
15216,Avocado and Tropical-Fruit Salsa ,4.375
15217,Honey-Mustard Chicken-Sausage Kebabs ,5.0
15218,Soy and Sesame Short Ribs ,3.125
15219,Kohlrabi Pickles With Chile Oil ,0.0
15220,Fresh Tomato Salsa ,3.75
15221,Asparagus with Wasabi-Mayonnaise Dip ,4.375
15222,Cuban-Style Roast Suckling Pig ,4.375
15223,Meringue-Topped Raspberry and Peach Ice Cream Cake ,5.0
15224,Garlic Bruschetta ,3.75
15225,"Cheddar Biscuits with Fried Eggs, Ham, and Brown Butter ",3.75
15226,Pinon ,3.75
15227,Lemon Crostata ,4.375
15228,Frozen Chocolate Bourbon Parfaits ,4.375
15229,Grilled Quail Salad with Honey-Dijon Dressing ,5.0
15230,Parmesan Walnut Salad in Endive Leaves ,4.375
15231,Citrus Syrup ,0.0
15232,Corn Bread Succotash Stuffing ,3.75
15233,Southeast Asian Squid Salad ,3.75
15234,Panettone Bread and Butter Pudding ,5.0
15235,"Beets with Goat Cheese, Nigella Seeds, and Pistachios ",3.75
15236,Cinnamon-Walnut Coffee Cake ,3.125
15237,Ultimate Turkey Stock ,5.0
15238,Saffron Mayonnaise ,5.0
15239,Apple and Nut-Butter Puff Pastry Tarts ,0.0
15240,"Cranberry, Pear, and Ginger Chutney ",3.75
15241,Fresh Fennel and Arugula With Meyer Lemon Dressing ,0.0
15242,Frozen Iced Coffee With Coffee Jelly ,4.375
15243,Paniolo Rack of Lamb ,4.375
15244,Asian Chicken Salad ,4.375
15245,Potato Parsnip Mash ,3.75
15246,Salt-Crusted Beets with Horseradish Crème Fraîche ,3.75
15247,Black and White Crème Brûlée ,3.75
15248,"Lemon, Sage, and Garlic Roast Chicken ",3.125
15249,"Lobster, Scallops, and Mussels with Tomato Garlic Vinaigrette ",3.75
15250,"Butter Beans with Butter, Mint, and Lime ",5.0
15251,Raisin Scones ,3.125
15252,Blackberry-Gin Fizz ,3.75
15253,Ramp and Walnut Pistou ,0.0
15254,Waffles with Frizzled Ham and Maple-Mustard Cream ,4.375
15255,Chili-Seasoned Fish Sticks ,3.75
15256,Zinfandel Beef Stock ,3.75
15257,Warm Almond Cakes With Grapes ,5.0
15258,Mirabelle Ginger Tart ,2.5
15259,Lamb Chops with Feta and Banyuls-Cherry Sauce ,3.75
15260,Sticky Cinnamon Rolls ,4.375
15261,Northwestern Wild Mushroom Stuffing ,4.375
15262,Plantain Flatbread With Poached Egg and Honey Drizzle ,0.0
15263,Lamb Köfte with Yogurt Sauce and Muhammara ,5.0
15264,Assorted Vegetables ,0.0
15265,Ginger Syrup ,0.0
15266,Rice Pilaf with Pistachios and Golden Raisins ,4.375
15267,Pasta with Confit Duck and Savoy Cabbage ,4.375
15268,Rosemary Citrus Miso-Rubbed Turkey ,4.375
15269,Herbed Orzo with Toasted Pine Nuts ,3.125
15270,Glazed Red Pepper-Fennel Almonds ,5.0
15271,Spiced and Steamed Couscous With Brown Butter ,0.0
15272,Baked French Toast with Cardamom and Marmalade ,4.375
15273,Chamomile Crème Anglaise ,3.75
15274,Frozen Strawberry-Banana Cake with Strawberry Sauce ,4.375
15275,Sour Cream Cake with Cardamom and Pistachios ,3.125
15276,"Spinach, Basil Ricotta Purée ",3.75
15277,Lemon Cloud ,2.5
15278,Chocolate Profiteroles with Coffee Ice Cream and Bittersweet Chocolate Sauce ,3.75
15279,Maraschino Cherry Parfaits ,0.0
15280,Spiced Peaches and Raspberries ,0.0
15281,Mixed Grill with Cherry Cola Barbecue Sauce ,4.375
15282,Shrimp with Ginger-Herb Butter ,4.375
15283,"Cranberry Sauce with Cherries, Marsala and Rosemary ",5.0
15284,Three-Cheese Pizza with Pancetta and Mushrooms ,4.375
15285,Molasses-Cured Pork Shoulder Bacon ,5.0
15286,Baked Pecan-Stuffed Nectarines ,4.375
15287,Chicken Sauté with Sherry ,4.375
15288,Raspberry Galettes ,3.75
15289,Agnolotti with Sweet Peas and Goat Cheese ,5.0
15290,Mango-Pineapple-Lime Cheesecake with Ginger Crust ,4.375
15291,Aged Sherry-Walnut Vinaigrette ,4.375
15292,Polenta Toasts with Goat Cheese and Fresh Thyme ,3.75
15293,Spiced Pork Tenderloin With Cherry-Thyme Pan Sauce ,4.375
15294,Mustard-Crusted Pork With Farro and Carrot Salad ,4.375
15295,Challah ,5.0
15296,"Penne with Pancetta, Sage, and Mushrooms ",5.0
15297,Seafood Stew with Leeks and Garlic ,4.375
15298,"Arugula, Fennel, and Parmesan Salad ",3.75
15299,Candied Butternut Squash ,3.75
15300,Steamed Japanese Rice ,0.0
15301,Santori ,4.375
15302,Orzo Risotto ,4.375
15303,Spiced Mixed Nuts ,3.75
15304,Eggplant Salad with Miso Ginger Dressing ,4.375
15305,Halibut in Chard Leaves with Lemon-Thyme Butter ,4.375
15306,Chimichurri Sauce ,3.75
15307,Vietnamese Fried Rice ,3.75
15308,Black-Eyed Pea and Bacon Salad with Mustard Vinaigrette ,3.75
15309,Hummus Tehina ,5.0
15310,Spaghetti with Lobster and Mussels ,4.375
15311,Rosanne Cash's Potato Salad ,4.375
15312,Farinata con Salvia ,4.375
15313,Raspberry and Peach Parfait Cake ,3.125
15314,"Arugula Salad with Caramelized Onions, Goat Cheese, and Candied Walnuts ",4.375
15315,Best Friends Forever Brownies ,5.0
15316,Sugar Snap Salad ,4.375
15317,Raisin Ginger Breads ,1.25
15318,Pesto ,4.375
15319,Herbed Rice ,4.375
15320,Ginger-Chili Dipping Sauce ,4.375
15321,Preserved Lemons ,4.375
15322,Chicken with Lemons and Olives Emshmel ,5.0
15323,Orange Tangerine Pudding ,3.75
15324,To Zest Citrus Fruits ,5.0
15325,Ras El Hanout ,3.75
15326,Grilled Fish with Orange-Fennel Salsa ,5.0
15327,Fresh Tomato Bruschetta ,5.0
15328,Chocolate Hazelnut Spiced Cookies ,3.75
15329,Red Bell Pepper and Tomato Salad ,3.75
15330,Turkey Osso Buco ,4.375
15331,Lemon-Nutmeg Custards ,3.75
15332,Dried Fruit Stewed with Brown Sugar and Vanilla ,4.375
15333,Warm Teriyaki Beef Salad ,3.75
15334,Rice Pudding Cake with Cherry-Apricot Compote ,4.375
15335,Broccoli with Garlic and Parmesan Cheese ,3.75
15336,Buttermilk Ice Cream with Spiced Fruit Compote ,3.125
15337,Chocolate Mint Layer Cake ,4.375
15338,Cinnamon Blueberry Muffins ,4.375
15339,Lamb Shank Ragù with Anson Mills Grits ,4.375
15340,Fragrant Orange Chicken with Scallion Mashed Potatoes ,3.75
15341,Maple Cheesecake with Maple-Cranberry Compote ,4.375
15342,Steamed Asian White Rice ,5.0
15343,Tropical Punch Colada ,0.0
15344,Couscous with Lamb Stew ,3.75
15345,Turkey Congee With Crispy Shiitake Mushrooms ,0.0
15346,Old-Fashioned Chicken and Corn Stew ,4.375
15347,Egg Tacos with Pumpkin-Seed and Tomato-Habanero Sauces ,3.75
15348,Mango in Ginger-Mint Syrup ,4.375
15349,Sausage and Potato Breakfast Casserole ,4.375
15350,Chocolate Truffle Pie with Orange-Champagne Sabayon and Strawberries ,3.75
15351,Maple Syrup Pie ,4.375
15352,Lemon Mascarpone Brûlée Tarts with Raspberry Sauce ,4.375
15353,Fresh Hot-Pepper Paste ,3.75
15354,Grilled Ground Lamb Kebabs with Fresh Hot-Pepper Paste ,4.375
15355,Gingerbread with Nectarines and Cream ,3.125
15356,Crispy Chicken Sandwich with Buttermilk Slaw and Herbed Mayo ,4.375
15357,Crisp Chocolate Marshmallow Squares ,3.125
15358,Spring Vegetable Ragoût with Fresh Chervil ,2.5
15359,Farro Spaghetti with Mushrooms and Hazelnuts ,0.0
15360,"Roasted Potatoes with Garlic, Lemon, and Oregano ",4.375
15361,Marinated London Broil with Lemon and Garlic ,3.75
15362,Potato Pancakes with Confit Duck and Red-Cabbage Beet Slaw ,0.0
15363,Curried Chicken ,4.375
15364,White Wine and Peach Sangria ,5.0
15365,Milk Pie ,3.125
15366,Grilled Skirt Steak Tacos with Roasted Poblano Rajas ,3.75
15367,"Fettuccine with Asparagus, Beet Green Pesto, and Poached Egg ",3.75
15368,Roasted Beet Salad with Flash-Pickled Radishes and Chard ,4.375
15369,Beet Risotto ,4.375
15370,Radish and Carrot Salad with Tuna and Capers ,4.375
15371,Sage Buttermilk Biscuits with Sausage and Cheddar ,4.375
15372,Frittata with Fennel-Spiced Pork and Asparagus ,5.0
15373,"Chicken, Green Bean, Corn, and Farro Salad with Goat Cheese ",4.375
15374,Tomales Bay Oysters Rockefellar ,5.0
15375,Parmesan Shortbread with Fennel and Sea Salt ,5.0
15376,Grits with Shrimp and Roasted Red Bell Pepper ,4.375
15377,Agnolotti with Meat and Spinach Filling ,3.75
15378,Bourbon Sloe Gin Cocktail ,0.0
15379,Mexican Coffee ,5.0
15380,"Smoked Fish with Cucumber ""Noodles"" ",2.5
15381,Potato Salad with 7-Minute Eggs and Mustard Vinaigrette ,3.75
15382,Sour Cherry Strudels ,3.75
15383,Spring Fever ,0.0
15384,Creamy Garlic Pasta with Mushrooms and Prosciutto ,4.375
15385,"Burnt Carrots with Goat Cheese, Parsley, Arugula, and Crispy Garlic Chips ",4.375
15386,"Fettuccine with Chicken, Red Onion and Peppers ",4.375
15387,Potted Cheese Spread with Crackers ,3.75
15388,"Cod with Lemon, Green Olive, and Onion Relish ",4.375
15389,Beef Tenderloin with Morels and Tarragon-Marsala Sauce ,5.0
15390,Vanilla Whipped Cream ,3.75
15391,"Beef Brisket Braised with Dried Fruit, Yams and Carrots ",4.375
15392,Grilled Sausages with Chunky Tomato Porcini Sauce ,3.75
15393,Chicken Marsala with Sage ,4.375
15394,Spicy Pecans ,3.125
15395,Frozen Milk Chocolate and Amaretto Mousse Pie ,3.75
15396,"Apple, Celery, and Walnut Salad ",3.75
15397,Roast Turkey with Pesto-Rice Stuffing ,5.0
15398,Mexican Chicken Salad ,3.75
15399,"Mushroom, Squash and Bell Pepper Salad ",3.75
15400,Salted Brown Butter Cookies ,5.0
15401,Four-Cheese Pasta with Cauliflower ,3.125
15402,Smoked Trout and Arugula Toasts ,3.75
15403,Green Goddess-Chive Dressing ,5.0
15404,Braised Chicken with Green Peppers and Tomatoes ,3.75
15405,Pastry Dough ,4.375
15406,Grilled Lamb with Curried Vegetables and Grape Pine Nut Gremolata ,5.0
15407,Linguine with Garlic Shrimp and Basil ,3.75
15408,California Barley Bowl with Lemony Yogurt Sauce ,4.375
15409,Farfalle with Tuna and Rosemary Mushroom Sauce ,1.25
15410,Passion Fruit “Crumble” ,0.0
15411,Mexican Floating Island with Kahlua Custard Sauce and Sesame Pumpkin-Seed Brittle ,4.375
15412,Spice-Rubbed Pork Tenderloin With Roasted Baby Carrots ,4.375
15413,Turkey Giblet Stock ,5.0
15414,Blueberry-Lemon Icebox Cake ,4.375
15415,"Crunchy Chicken Salad with Shiitake Mushrooms, Spicy Sesame Dressing and Peanuts ",4.375
15416,Free-Form Beesting Cake ,3.125
15417,Spicy Soy Glaze ,4.375
15418,Roasted Strawberries ,0.0
15419,Caramelized Fresh Pineapple Tiramisu ,4.375
15420,"Tequila, Apple, and Dried Cranberry Compote ",4.375
15421,Potato and Carrot Gratin Diamonds ,3.75
15422,Tomato-Avocado Salsa ,4.375
15423,Indian-Spiced Pickled Vegetables ,2.5
15424,Grilled Pork Chops with Sweet Lemongrass Marinade ,5.0
15425,Romaine and Red Onion Salad with Parmesan Balsamic Vinaigrette ,3.75
15426,Curried Bean and Bell Pepper Soup ,0.0
15427,Modern Sausage Sandwich with Ginger and Mustard Relish ,3.75
15428,French Bread Pudding ,3.75
15429,Thai Chicken and Shrimp Noodle Salad ,4.375
15430,Verjus Relish ,3.75
15431,Greens-Filled Ravioli with Walnuts ,3.75
15432,Wine-Braised Red Cabbage ,3.75
15433,Linguine with Summer Peppers and Sausage ,3.75
15434,Lima Bean Purée ,4.375
15435,Stuffed Sweet Potatoes ,3.125
15436,Creamy Slaw ,3.75
15437,Primavera Risotto Nests with Fried Eggs ,4.375
15438,Crispy Chicken Wings ,5.0
15439,Skewered Rosemary Shrimp with Mint Pesto ,4.375
15440,Sweet Pastry Dough ,5.0
15441,Apple and Cranberry Crisps with Ginger-Pecan Topping ,4.375
15442,Rigatoni with Eggplant and Pine Nut Crunch ,4.375
15443,Marmalade Cake ,3.75
15444,Chili-Rubbed Baby Back Ribs with Espresso Barbecue Sauce ,4.375
15445,Steamed Mussels with Tomato and Chorizo Broth ,5.0
15446,Chunky Beef and Vegetable Soup ,3.125
15447,"Grilled Artichokes with Olive Oil, Lemon, and Mint ",4.375
15448,Oval Masa Cakes with Goat Cheese Filling ,3.75
15449,Applejack Spritzer ,0.0
15450,Trout with Tropical Fruit Salsa and Mixed Greens ,4.375
15451,Winter Fruit and Nut Stuffing ,5.0
15452,"""Coffee and Doughnuts"" ",3.75
15453,Lean Lasagna ,4.375
15454,Cowboy Frittata ,5.0
15455,Beef and Potato Supper Pot ,3.75
15456,Brandied Black Cherries ,5.0
15457,Cardamom Crescents ,5.0
15458,"Banana, Coffee, Cashew, and Cocoa Smoothie ",5.0
15459,Butternut Squash Pizza ,4.375
15460,Tom Valenti's Lamb Shanks ,4.375
15461,Mac Sauce (Béchamel 101) ,5.0
15462,Spiced Rice Basmati ,4.375
15463,Sage and Pancetta Biscuits with Fontina Cheese ,4.375
15464,Champagne Punch ,4.375
15465,Green Onion Sausage and Shrimp Gravy ,4.375
15466,Slow-Cooked Veal Grillades ,4.375
15467,Ginger-Garlic Shrimp ,3.75
15468,Chilled Watermelon Soup ,3.125
15469,Black-Olive Yogurt Cheese with Flatbread ,3.125
15470,Cream Cheese ,0.0
15471,Chocolate Raspberry Shake ,0.0
15472,Margarita Chicken ,3.125
15473,"Eggplant Steaks with Salad of Roasted Peppers, Olives, Feta and Garbanzo Beans ",4.375
15474,Shallot Vinaigrette ,4.375
15475,Chicken Liver Pâté ,0.0
15476,Turkey Burgers with Chipotle-Chili Tartar Sauce ,4.375
15477,"Fava Bean, Radish, and Corn Salad ",0.0
15478,Smoky Two Chile Salsa ,4.375
15479,Butterscotch Blondie Bars With Peanut-Pretzel Caramel ,3.75
15480,Grilled Citrus Salmon ,4.375
15481,Pan-Fried Flounder with Potatoes in Parsley ,3.75
15482,Honeydew in Cardamom Lime Syrup with Vanilla Cream ,4.375
15483,Green Olive and Goat Cheese Crostini ,4.375
15484,Pan Seared Sea Scallops with Chorizo and Fu Fu ,3.75
15485,"Couscous Salad with Currants, Pine Nuts, and Celery ",5.0
15486,Cheese Toast ,3.75
15487,Chana Masala ,4.375
15488,Pizza Dough ,4.375
15489,Grilled Leg of Lamb with Rosemary Salt ,5.0
15490,"""Pot Roast"" of Seitan, Aunt Gloria-Style ",2.5
15491,Yogurt Cake with Currant Raspberry Sauce ,4.375
15492,Quinoa Stir-Fry with Vegetables and Chicken ,4.375
15493,Citrus-Cured Salmon ,0.0
15494,Raspberry Zing Syrup ,0.0
15495,Salt-Grilled Shrimp ,1.875
15496,Cheddar Dill Biscuits ,4.375
15497,Salmon and Vegetable Chowder ,3.75
15498,"Beef Tenderloin Medallions with Potato ""Risotto"" ",5.0
15499,Golden Slipper ,0.0
15500,Brown Rice and Barley ,4.375
15501,"Roast Chicken with Rosemary, Lemon, and Honey ",4.375
15502,Basil-Mint Sauce ,3.125
15503,Cantaloupe and Prosciutto with Basil Oil ,4.375
15504,"Braised Bacon, Pomegranate, and Pine Nut Relish ",4.375
15505,Chilled Corn Soup with Crab and Chile Oil ,3.75
15506,Grilled Lamb Kebabs with Coriander and Cumin ,4.375
15507,Three-Cheese Mushroom and Spinach Calzone ,4.375
15508,Broiled Duck Breasts with Orange Chipotle Sauce ,4.375
15509,Dandelion Greens with Hot Olive-Oil Dressing ,4.375
15510,Soy-Glazed Shiitake Mushrooms ,4.375
15511,"Arugula, Pear and Stilton Salad ",4.375
15512,Baked Irish Bacon with Kumquat Glaze ,3.75
15513,Shaved Fennel and Arugula Salad ,5.0
15514,Balsamic Strawberries ,4.375
15515,Lemon-Almond Buttermilk Loaf with Balsamic Strawberries ,4.375
15516,Fresh Tomato and Onion Chutney ,3.75
15517,Blackberry-Cinnamon Cobbler ,4.375
15518,Herbed Cottage Cheese with Multigrain Bread ,2.5
15519,Mustard and Spring Onion Mash ,3.75
15520,Rhubarb-Fennel Gin Cocktail ,0.0
