id,title,rating
5029,Salsa Verde ,5.0
5030,Yellow Parrot ,0.0
5031,Eggplant and Spinach Lasagne Spirals ,4.375
5032,Butternut Squash and Radicchio Pappardelle ,3.75
5033,Link Family Crawfish Boil ,0.0
5034,Teriyaki Tofu Triangles ,3.75
5035,Rugelach ,4.375
5036,Chunky Two-Cheese Potatoes with Garlic and Pesto ,3.75
5037,Strawberry and Cream Cake with Cardamom Syrup ,4.375
5038,Tuna in Tomato Sauce ,3.75
5039,Asian Chicken Salad ,3.75
5040,"Tiny Potato Dumplings with Tomato, Onion, and Guanciale Sauce ",4.375
5041,Warm Arugula Salad with Garlic Croutons ,4.375
5042,Tropical Fruit Salad ,0.0
5043,Smoky Ricotta Fritters ,3.125
5044,Magnolia ,0.0
5045,Steak and Jalapeño Tacos ,3.75
5046,Strip Steak with Japanese Dipping Sauce ,4.375
5047,"Orecchiette, Broccoli ",3.75
5048,Merry Sparkler ,0.0
5049,Beet and Carrot Salad With Curry Dressing and Pistachios ,5.0
5050,Cappuccino Brownies ,4.375
5051,Shrimp in Sherry Butter Sauce ,3.75
5052,"Coconut Tapioca With Pineapple, Mango, And Lime ",0.0
5053,Crab Cakes and Baby Greens with Lemon Vinaigrette ,5.0
5054,Pork Satay with Fresh Vegetable Pickles ,3.125
5055,Mango Chutney ,5.0
5056,Lemon-Rosemary-Marinated Ripe Olives ,3.75
5057,Raspberry Orange Shake ,0.0
5058,"Cranberry, Ginger and Peach Preserves ",4.375
5059,Cauliflower and Leek Risotto ,3.75
5060,Pistachio Brittle Cheesecake ,5.0
5061,Fig-Olive Tapenade ,3.75
5062,Crispy Baby Yukon Gold Potatoes ,0.0
5063,"Vegetable Platter with Cannellini ""Hummus"" ",3.125
5064,Spicy French Fries ,3.75
5065,Sweet Bavarian Mustard ,0.0
5066,Vanilla Cream and Apricot Tart ,3.75
5067,Sour Orange Mojo ,5.0
5068,Branzino and Roasted Baby Vegetables with Tarragon-Chive Oil ,4.375
5069,Creamed Spinach with Golden Breadcrumb Topping ,3.125
5070,Frozen Butter Pastry Dough ,4.375
5071,Asparagus and Salmon Roe with Egg Sauce ,3.75
5072,Dominican Chimichurri Burgers ,5.0
5073,Grilled Mahi-Mahi Tacos ,5.0
5074,English Chili Sauce ,0.0
5075,Cucumber Horseradish Sauce ,4.375
5076,Yogurt-Braised Chicken with Cashews and Raisins ,3.75
5077,"Tomato, Onion, and Serrano Chile Salsa ",3.75
5078,Strawberry Cream Puffs with Strawberry Sauce ,4.375
5079,Avocado Salsa ,3.75
5080,Ancho-Guajillo Chile Sauce ,4.375
5081,White Bean and Escarole Soup with Spicy Polenta ,1.875
5082,Sauteed Curried Beef and Broccoli ,3.75
5083,"Artichoke Stew with Mussels, Potatoes and Saffron ",2.5
5084,Fennel and Sausage Ragù Over Pasta ,3.75
5085,Jalapeño Lime Vinaigrette ,3.125
5086,Curried Pumpkin Soup ,4.375
5087,Garlic-Aioli Roasted Turkey with Lemon-Parsley Au Jus ,4.375
5088,Two-Potato Salad with Mustard Dressing ,4.375
5089,Chicken with Balsamic Vinegar ,3.75
5090,Garlic and Saffron Soup ,3.75
5091,Spinach Lasagna ,2.5
5092,Basic Creole Spices ,5.0
5093,Jalapeño Cheese Grits ,4.375
5094,Maple Baked Beans ,3.75
5095,Brandied Plum Clafoutis ,4.375
5096,"Orange, Jícama, Radish, and Pork Rind Salad ",3.125
5097,Red-Wine Pot Roast with Porcini ,4.375
5098,Turkey Giblet Stock ,5.0
5099,Grilled Flatiron Steak with Toasted Spice Vinaigrette ,4.375
5100,Epi's 50-Ingredient Super Bowl Nachos ,4.375
5101,Lemon-Tarragon Chicken Salad Sandwiches ,4.375
5102,Love ,5.0
5103,Sunset Sorbet Sundaes ,0.0
5104,Porcini Mushroom Sauce ,5.0
5105,Chicken with Tarragon Vinegar Sauce ,3.75
5106,Pork Spice Rub ,3.75
5107,Risotto Primavera ,4.375
5108,"Oatmeal, Fig, and Walnut Bars ",4.375
5109,Green Bean and Cherry Tomato Salad with Herb Dressing ,3.75
5110,Rough-Mashed Parsnips and Potatoes ,0.0
5111,Spicy Oven-Roasted Potatoes ,3.75
5112,Lemon Cream Cheese Frosting ,4.375
5113,"Pureed Celery Root, Parsnips and Potatoes ",3.75
5114,Escarole with Italian Sausage and White Beans ,4.375
5115,Almond-Oat Strawberry Shortcakes ,4.375
5116,Blueberry-Lemon Cake with Lemon Cream Cheese Frosting ,4.375
5117,Pan Bagnat with Fennel ,0.0
5118,Cornmeal Hoecakes ,5.0
5119,New Orleans-Style Red Beans and Rice with Sausage Fulcher ,4.375
5120,Tortillas in Black-Bean Purée ,5.0
5121,Slow Roasted Lamb Shanks with Braised Lentils ,4.375
5122,Braised Lamb Shanks With Fish Sauce ,5.0
5123,"Strawberry-Rhubarb ""Courting"" Cake ",4.375
5124,Golden Beet Carpaccio ,4.375
5125,"Butter Lettuce, Persimmon, Feta, and Hazelnut Salad ",4.375
5126,Bachelor's Bait ,0.0
5127,Loin of Veal with Shiitake Stuffing ,3.75
5128,Baked Yams with Cinnamon-Chili Butter ,3.75
5129,"Pink Grapefruit, Strawberry, and Champagne Granita with Sugared Strawberries ",4.375
5130,Pear-Caramel Ice Cream Sundaes ,1.25
5131,Purple-Potato and Crab Gratin ,3.75
5132,Poached Halibut with Black Truffles and Purple-Potato and Crab Gratin ,3.125
5133,Sauteed Halibut with Lemon-Vegetable Relish ,4.375
5134,Smoked Duck Toasts with Gingered Rhubarb ,3.75
5135,Cheesy Zucchini and Red Onion Flatbread ,4.375
5136,"Goat Cheese Marinated in Rosemary, Fennel, and Hot Red Pepper ",3.75
5137,Swiss Cheese and Porcini Fondue ,4.375
5138,Cold Sesame Egg Noodles ,4.375
5139,Semolina Cake With Oranges ,3.75
5140,Grilled Turkey with Cranberry Gravy ,4.375
5141,Duchess Baked Potatoes ,3.75
5142,Chicken and Fennel Pie with Bacon-Biscuit Crust ,3.75
5143,Arugula and Goat Cheese Ravioli ,3.75
5144,"Calzones with Cheese, Sausage and Roasted Red Pepper ",3.75
5145,Seaweed Salad ,4.375
5146,,-1.0
5147,Caponatina Toasts ,3.125
5148,Buttermilk Corn Bread ,3.75
5149,Griddled Tomato-Chipotle Salsa ,4.375
5150,Strawberry Cheesecake Milkshake ,1.25
5151,Goat Cheese Chocolate Truffles ,4.375
5152,Horseradish Sauce ,5.0
5153,Mushroom-Miso-Mustard Gravy ,4.375
5154,Chocolate Sabayon ,4.375
5155,Glazed Onions ,4.375
5156,Shredded Beef Tostadas with Chiles and Lime ,0.0
5157,Raspberry Swirl Parfaits ,4.375
5158,"Pasta with Pesto, Broccoli, and Potatoes ",3.75
5159,"Salmon Cakes
                With Arugula Salad ",4.375
5160,Strawberry Ice Cream ,4.375
5161,Open-Face Lamb Burgers with Mint Yogurt Sauce ,4.375
5162,To Toast and Skin Hazelnuts ,5.0
5163,Hazelnut Praline ,3.75
5164,Chocolate Hazelnut Praline Torte with Frangelico Whipped Cream ,3.75
5165,Caramelized Apple and Pear Pie ,3.125
5166,Norma Naranjo's Tamales ,0.0
5167,Canyon Ranch Grilled Portobello Sandwich with Roasted Peppers ,3.75
5168,Pork Chops with Apple Balsamic Sauce and Blue Cheese Tomato Gratin ,4.375
5169,Apricot Stars ,4.375
5170,Coconut Cream Pie with Macaroon Press-In Crust ,5.0
5171,Marinated Vegetables with Mustard Dill Dressing ,4.375
5172,Modern Waldorf Salad ,3.75
5173,Confetti Rice with Baked Tofu and Green Onion Omelet Strips ,3.75
5174,Toasted Blue Cheese and Caramelized Onion Sandwiches ,4.375
5175,Grilled Steak with Parsley-Parmesan Salad ,5.0
5176,Roasted Potatoes with Sour Cream and Bacon ,4.375
5177,"White Bean, Sun-dried Tomato, and Feta Bites ",4.375
5178,Pot Roast with Caramelized Onions and Roasted Carrots ,4.375
5179,Potato Chowder ,3.75
5180,Broccoli Rabe with Bulgur and Walnuts ,4.375
5181,Scallop and Vegetable Stir-Fry ,2.5
5182,"Roasted Chicken, Bell Pepper and Onion Salad ",4.375
5183,Sea Salt-Roasted Pecans ,3.75
5184,Frozen Nougat Terrine with Bittersweet Chocolate Sauce and Raspberry-Fig Sauce ,4.375
5185,Tomatillo Salsa ,4.375
5186,Pork Scaloppine with Herbed Noodles ,3.75
5187,Kale with Garlic and Bacon ,4.375
5188,Coconut Milk Whipped Cream ,1.875
5189,Poached Halibut with Black Truffles and Purple-Potato and Crab Gratin ,3.125
5190,Rosemary and Cranberry Soda Bread ,3.75
5191,Jalapeño-Cilantro Salsa ,3.75
5192,Pasta with Creamy Wild Mushroom Sauce ,3.75
5193,Pesto Goat Cheese Spread ,4.375
5194,Custard Sauce ,4.375
5195,To Render Beef Suet ,3.125
5196,Suet Pastry Dough ,1.25
5197,Candied Orange Zest ,3.125
5198,Belize-Style Sweet Potato Pudding ,4.375
5199,Fennel-Saffron Compote ,5.0
5200,Spotted Dick ,4.375
5201,Honey-Ginger Barbecue Sauce ,4.375
5202,Brown Chicken Stock ,4.375
5203,Baked Spiced Butternut Squash with Apples and Maple Syrup ,4.375
5204,Turkey Gravy ,3.75
5205,Rosemary-Roasted Turkey with Gravy ,5.0
5206,No-Bake Chocolate Biscuit Cake with Dried Cherries ,3.75
5207,Garden Greens and Goat Cheese Pasta ,5.0
5208,Watermelon-Honeydew Kebabs with Lime-Poppy Seed Dressing ,3.125
5209,"Tacos of Carnitas Roasted with Orange, Milk, and Pepper ",4.375
5210,Shrimp with Snow Peas ,3.75
5211,Classic Sour Cherry Pie with Lattice Crust ,4.375
5212,Seafood Canapes with Lemon-Chive Butter ,5.0
5213,Sake-Marinated Sea Bass with Coconut-Curry Sauce ,5.0
5214,Squash and Sweet-Potato Soup with Chipotle Sauce ,4.375
5215,Chocolate-Caramel Tartlets with Roasted Bananas and Ginger-Citrus Caramel ,4.375
5216,Plum Almond Tartlets ,5.0
5217,Green Juice with Baobab Powder ,0.0
5218,Brisket Braised in Porter ,5.0
5219,Buckwheat Crêpe Noodles with Chive Butter ,4.375
5220,Philadelphia Fish House Punch ,3.75
5221,Bourbon Sauce ,4.375
5222,Spinach Linguine with Goat Cheese ,3.75
5223,Cognac-Glazed Dried Apricots with Cinnamon-Spiced Yogurt ,4.375
5224,Baby Squash Sauté Szwarc ,3.125
5225,Roasted-Tomatillo and Lime Salsa ,4.375
5226,Aunt Tom's Italian Cream Cake ,5.0
5227,Roast Fresh Ham ,3.75
5228,Jalapeño-Goat-Cheese Hush Puppies ,4.375
5229,Strawberry Italian Ice ,3.75
5230,Orange-Scented Bittersweet Chocolate Cake with Candied Blood Orange Compote ,4.375
5231,Bacon Cheddar Quick Bread with Dried Pears ,2.5
5232,Chocolate Almond Sherry Cake with Caramelized Pears ,3.75
5233,Sausage and Egg Casserole with Sun-Dried Tomatoes and Mozzarella ,4.375
5234,Chocolate Pecan Dollars ,3.75
5235,Nectarine-Raspberry Crisp with Spiced-Oatmeal Crumb Topping ,4.375
5236,Croissant Steak Sandwiches with Caramelized Onions and Horseradish Mayonnaise ,4.375
5237,Garlic-Herb Mashed Potatoes ,4.375
5238,Vegetable Broth ,0.0
5239,All-Butter Pastry Dough ,4.375
5240,Potato and Porcini Gratin ,4.375
5241,Sweet Potato Gnocchi with Fried Sage and Shaved Chestnuts ,4.375
5242,Roasted Poblano-Cream Soup ,3.75
5243,"Chicken Skin With Peanuts, Chiles, and Lime ",0.0
5244,"Toasted Orzo with Peas, Onion and Bacon ",3.75
5245,"Tunisian Bell Pepper, Tomato, Tuna and Egg Salad ",3.75
5246,"Veal Shanks, Artichoke Hearts, and Chick-Peas with Preserved Lemon ",1.25
5247,Celery and Parsnip Soup with Green Onion-Dill Matzo Balls ,4.375
5248,Concord Grape Sorbet With Rosemary And Black Pepper ,0.0
5249,Poached Pears with Sweet Wine and Fruit Confetti ,4.375
5250,Spicy Soba Noodles with Shiitakes and Cabbage ,4.375
5251,Hungarian Chocolate Mousse Cake Bars ,4.375
5252,Goat Cheese Souffles and Mixed Greens with Raspberry Vinaigrette ,4.375
5253,Linguine with White Clam Sauce ,4.375
5254,"Herb-Basted Chicken with Pearl Barley, Bacon, and Root Vegetable Pilaf ",4.375
5255,Ham Braised with Maple Raisin Sauce ,3.75
5256,Dirty Rice Stuffing ,4.375
5257,Crimson Royale ,0.0
5258,Black-Eyed Pea and Pumpkin Salad ,3.75
5259,Roast Duck Breast with Balsamic and Apricot Sauce ,4.375
5260,Yucatecan-Style Pork ,5.0
5261,Thyme Pesto ,4.375
5262,Shrimp Stuffed Avocado ,2.5
5263,"Arugula and Mint Salad with Oil-Cured Black Olives, Oranges, and Ricotta Salata ",4.375
5264,Crab Cakes with Tomato Cream Sauce ,4.375
5265,Pizza Dough ,3.75
5266,Sweet Potato Pudding with Pecan and Gingersnap Topping ,4.375
5267,Creamed Kale with Crispy Shallots ,2.5
5268,"Watercress, Celery, and Red Onion Salad ",3.75
5269,Pork Tenderloin with Mango Chutney ,3.75
5270,"Baked Halibut with Paprika,olives and Mushrooms ",4.375
5271,"Steamed Snapper with Ginger, Lime, and Cilantro ",4.375
5272,Sazerac ,0.0
5273,Onion and Bacon Tart ,4.375
5274,Cooked Rice ,0.0
5275,Bourbon Balls ,4.375
5276,Red-Wine-Braised Duck Legs with Roasted Pears and Onions ,4.375
5277,"Chicken, Sausage, and Okra Gumbo ",2.5
5278,Chicken with Cranberry-Mustard Sauce ,3.75
5279,Asparagus and Prosciutto Bundles ,4.375
5280,Cantaloupe Basil Salsa ,3.75
5281,Rice and Lentil Salad with Orange and Dried Cherries ,4.375
5282,Endive with Smoked Trout and Herbed Cream Cheese ,4.375
5283,Spiced Cranberry-Pear Tart ,4.375
5284,Tangerine-Date Tartlets with Buttermilk Whipped Cream and Tangerine Granita ,3.75
5285,Chocolate-Banana Tarts ,1.875
5286,Spanakopita ,4.375
5287,Heirloom Tomato Salad ,3.125
5288,Miso-Glazed Tuna Kebabs ,2.5
5289,"Slow-Cooked Salmon, Chickpeas, and Greens ",3.75
5290,Herb Salt ,0.0
5291,Bittersweet Chocolate Sauce ,3.75
5292,Pickled Pears ,3.125
5293,Watermelon-Lime Sorbet ,3.75
5294,Apricot-Riesling Jam ,0.0
5295,Bittersweet Chocolate Sauce ,0.0
5296,Shrimp Creole ,3.75
5297,Grilled Pork Kebabs with Ginger Molasses Barbecue Sauce ,4.375
5298,"Pepper-Crusted Beef, Bacon, and Arugula Sandwiches with Spicy Mustard ",5.0
5299,Chilled Coconut Corn Soup ,3.75
5300,Passion-Fruit Nieve ,5.0
5301,Bruschetta with Roasted Red Bell Peppers ,3.75
5302,"Figs with Balsamic Vinegar, Mascarpone, and Walnuts ",4.375
5303,Grilled Hoisin-Soy Steaks with Shiitake and Bok Choy ,3.75
5304,"Modern Chop Suey with Shallots, Ginger, and Garlic Essence ",3.75
5305,Nectarine-Red Wine Sauce ,4.375
5306,"Farfalle with Four Cheeses, Carrots, Peas and Prosciutto ",3.125
5307,Crown Roast of Pork with Sausage Stuffing ,3.75
5308,Meyer Lemon Marmalade ,5.0
5309,Pineapple Pork Chops ,3.75
5310,Dill Sauce ,4.375
5311,"Rigatoni with Brie, Grape Tomatoes, Olives, and Basil ",4.375
5312,Shrimp with Zucchini Fritters and Grape-Leaf Spread ,4.375
5313,Homemade Sweet-and-Sour Mix for Margaritas ,4.375
5314,Honey Mustard Dressing ,4.375
5315,Veal Cutlets with Sauteed Baby Artichokes ,4.375
5316,Whipped Chipotle Sweet Potatoes ,4.375
5317,Lemon Curd Mousse with Toasted Coconut and Blueberries ,3.75
5318,Baked Risotto with Roasted Vegetables ,3.75
5319,Mashed Potatoes with Leeks and Garlic ,4.375
5320,Spicy Tortilla Strips ,3.75
5321,Crackling Corn Bread Dressing ,3.75
5322,Brown Rice and Beans with Ginger Chile Salsa ,5.0
5323,Flank Steak with Chimichurri ,4.375
5324,Leek and Celery Pie ,3.125
5325,"Artichoke, Potato, and Portobello Mushroom Casserole ",3.125
5326,Black Grape Compote ,0.0
5327,Linguine with Tomatoes and Artichoke Hearts ,4.375
5328,Pasta Primavera ,4.375
5329,Cole Slaw ,3.75
5330,Beef Empañadas ,4.375
5331,Fiesta Tortilla Salad ,4.375
5332,Creamy Baked Polenta with Herbs and Green Onions ,4.375
5333,"Linguine with Red, Yellow, and Orange Tomatoes ",4.375
5334,"Crispy Skate with Cauliflower, Bacon, Capers, and Croutons ",3.75
5335,Orange-Roasted Baby Carrots with Honey ,4.375
5336,Thanksgiving Skillet Pizza ,0.0
5337,Lemon Blueberry Cobbler ,3.75
5338,Walnut Spice Cake with Lemon Glaze ,3.75
5339,Sauteed Duck Breast with Figs and Port ,4.375
5340,Pineapple-Citrus Juice ,5.0
5341,Fruit Kebabs with Vanilla Mint Yogurt Sauce ,3.75
5342,Dukkah-Crusted Lamb Chops with Pomegranate Molasses ,5.0
5343,Fresh Lime Tart with Meringue Lattice and Glazed Berries ,4.375
5344,Tropical Glazed Ham with Curried Pineapple Chutney ,3.75
5345,Chicken and Spelt Soup with Greens ,4.375
5346,Peachy Grilled Chicken Salad ,4.375
5347,Chilled Crab Cakes with a Tropical Fruit Coulis ,3.125
5348,"Mixed Citrus ""Marmalade"" ",5.0
5349,Pistachio Cardamom Butter Cookies ,4.375
5350,Dark Chocolate Orange Soufflé with White Chocolate Chunk Whipped Cream ,5.0
5351,Wakame ,5.0
5352,Pork Tenderloin with Pomegranate Sauce ,4.375
5353,Microwave Brown Roux ,3.125
5354,Fish Fillets in Mole Verde ,3.125
5355,Chicken-Pine Nut Dumplings with Chili-Chili Dipping Sauce ,4.375
5356,Oatmeal Praline Ice Cream with Warm Berry Sauce ,3.125
5357,Shortcut Turkey Stock ,5.0
5358,Italian Sausage and Tortellini Soup ,4.375
5359,Cheddar Cheese Biscuits ,4.375
5360,Wasabi Lime Crab Salad in Cucumber Cups ,3.75
5361,Pea and Parmesan Wonton Ravioli ,4.375
5362,Ricotta-Pumpkin Gnocchi With Brown Butter ,3.125
5363,Rhubarb Charlotte ,3.125
5364,Roasted Chicken with Dijon Sauce ,3.75
5365,Grilled Teriyaki Pork Chops with Pineapple Papaya Relish ,4.375
5366,Lemon-Oregano Chicken ,4.375
5367,Eggplant Parmesan ,5.0
5368,Ziti with Kielbasa and Sauerkraut ,3.75
5369,"Trout with Red Cabbage, Jicama, and Chipotle Slaw ",5.0
5370,Oysters with Spicy Jícama Salad ,0.0
5371,Spiced Rum No. 5 ,5.0
5372,Fresh Corn Spoon Bread ,3.75
5373,Ras-El-Hanout ,4.375
5374,Beef Rolls with Ham and Vegetables Stuffing ,4.375
5375,Green-Peppercorn Cornmeal Crackers ,5.0
5376,Veal Marsala ,4.375
5377,Deviled Crab Tart ,4.375
5378,Lime-Saffron Syrup ,2.5
5379,Acini di Pepe Pasta with Garlic and Olives ,4.375
5380,Cilantro-Chipotle Tilapia ,4.375
5381,Creamy Scrambled Eggs with Spinach ,3.75
5382,Honey Barbequed Salmon with Mâche ,4.375
5383,Curried Egg Salad ,4.375
5384,"Soba with Pea Shoots, Shiitake Mushrooms, and Leeks ",3.75
5385,Shrimp with Mango Sauce ,3.75
5386,Lemon Olive-Oil Cake ,4.375
5387,Roasted Peperonata ,5.0
5388,Fettuccine With Artichokes ,3.75
5389,Chicken With Olive Tapenade ,5.0
5390,Red-Wine-Braised Duck Legs ,5.0
5391,Lemon Pudding ,1.25
5392,Figs in Red-Wine Syrup ,4.375
5393,Scallops with Apple-Curry Sauce ,4.375
5394,Green Salad with Olives ,0.0
5395,Broccolini with Italian Herb Oil ,3.75
5396,Fennel and Celery Salad with Pumpkin Seeds ,3.75
5397,Napa Valley Cabernet Burgers ,4.375
5398,Jerk Chicken ,3.125
5399,"Baked Apples with Toffee, Bourbon and Molasses ",4.375
5400,"Pear, Blue Cheese, and Fig Napoleons ",4.375
5401,Grilled Lamb Loin With Tomato and Cucumber Raita and Israeli Couscous ,3.75
5402,Roasted Sweet Potatoes with Mushrooms and Shallots ,4.375
5403,Barbary Coast ,2.5
5404,"Spinach, Basil Ricotta Purée ",3.75
5405,Basic Oven-Baked Marinated Tempeh ,4.375
5406,Sachertorte ,4.375
5407,Sliced Baked Ham with Camembert Sauce ,3.75
5408,Parmesan Onion Puffs ,4.375
5409,Beef Tenderloin with Goat Cheese Sauce ,4.375
5410,"Pasta with Shrimp, Tomatoes and Arugula ",3.75
5411,Imperial Peach Sundaes ,0.0
5412,Zucchini Cones Filled with Lemon Mint Pea Purée ,2.5
5413,Jamaican Coffee Brownies with Pecans ,3.75
5414,Scallops with Asian Noodle Salad ,4.375
5415,Pear and Apple Crostata with Five-Spice Whipped Cream ,4.375
5416,Portuguese Corn Bread ,2.5
5417,"Watermelon, Strawberry, and Mint Smoothie ",4.375
5418,Streusel-Roasted Plums with Vanilla Ice Cream ,5.0
5419,Apple Ginger Upside-Down Cake ,3.125
5420,"Green Bean, Orange, and Green Olive Salad ",3.75
5421,Braised Lamb Shanks with White Beans ,4.375
5422,Greek Honey and Anise Twists ,3.75
5423,Grilled Whole Turkey ,4.375
5424,,-1.0
5425,Mustard Dill Sauce ,3.75
5426,Tropical Margarita ,5.0
5427,Mixed-Mushroom and Tarragon Gravy ,4.375
5428,Pearl Oyster Bar Tartar Sauce ,4.375
5429,Mango Curry Truffles ,3.75
5430,Egg Sponge ,0.0
5431,Sweet Pastry Dough ,3.75
5432,Tuscan Kale with Sesame Oil ,5.0
5433,Ginger Cakes with Molten Chocolate Centers and Ginger Crème Anglaise ,4.375
5434,Pumpkin Mustard Relish ,1.875
5435,Crab Cakes with Herb Salad ,5.0
5436,Smoked Whiskey Wings ,5.0
5437,Anise Cookie Baskets with Riesling Ice Cream and Fresh Fruit ,5.0
5438,Rosemary-and-Pepper Standing Rib Roast with Two-Mushroom Pan Sauce ,4.375
5439,Sweet Potato Salad with Chili-Lime Dressing ,3.75
5440,Quick Apple Tart ,4.375
5441,Grilled Chicken with with Tamarind-Orange Glaze ,4.375
5442,Herb- and Spice-Roasted Beef Tenderloin with Red Wine-Shallot Sauce ,4.375
5443,Golden Colcannon Pie ,4.375
5444,Red Currant-Glazed Turkey with Sage and Red Currant Gravy ,3.75
5445,Crunchy Wasabi-Crusted Fish with Red-Cabbage Slaw ,4.375
5446,Maple Syrup Candies ,0.0
5447,Garlic Anchovy Artichoke Hearts ,0.0
5448,Roasted Chicken with Garbanzo Ragoût and Gremolata ,4.375
5449,Pesto From the Sea ,0.0
5450,Seafood and Fennel Soup ,4.375
5451,"New England Blackberry ""Torte"" ",3.75
5452,Slow-Roasted Chicken With All the Garlic ,0.0
5453,"Tagliatelle with Spotted Sardines, Eggplant, and House-Baked Ricotta Salata ",1.25
5454,Pasta with Spring Vegetables and Prosciutto ,4.375
5455,Spicy-Sweet Tangerine Shrimp with Baby Bok Choy ,4.375
5456,Austrian Sweet Cheese Crepes Baked in Custard ,4.375
5457,Vegetable and Tofu Red Curry ,3.75
5458,"Tagliatelle with Shredded Beets, Sour Cream, and Parsley ",4.375
5459,Date Paste ,0.0
5460,Moroccan Lamb Kebabs with Golden Couscous ,5.0
5461,Julia's and Jacques's Deglazing Sauce for Roast Chicken ,4.375
5462,"Spinach, Feta, and Pine-Nut Phyllo Tart ",4.375
5463,Anise-Scented Fig and Date Swirls ,4.375
5464,Mutabal ,5.0
5465,Coleslaw with Bay Shrimp and Tarragon ,3.125
5466,Veal Scaloppine with Mushroom Cream Sauce ,3.75
5467,Mint-Chocolate Ice Cream Sandwich Cake ,4.375
5468,Cioppino ,4.375
5469,"Butter Lettuce Salad with Bacon, Dried Cherries, and Roquefort Vinaigrette ",4.375
5470,Turkey Enchiladas with Red Chili Sauce ,3.75
5471,Hanger Steak with Shallots ,4.375
5472,Olive-Oil-Poached Salmon and Braised Artichokes with Sauvignon Blanc ,4.375
5473,Lamb and Broccoli Stew ,3.75
5474,Manhattan-Style Seafood Stew ,4.375
5475,Salmon Wrapped Poached Eggs ,4.375
5476,Hazelnut-Cinnamon Biscotti ,3.125
5477,Pasta with Butternut Squash and Sage ,3.75
5478,Berry Compote with Crispy Won Ton Strips and Vanilla Ice Cream ,4.375
5479,Grilled Butterflied Leg Of Lamb With Fresh Mint-Pepper Jelly ,5.0
5480,"Fried Squid, Papaya, and Frisée Salad with Spicy-Sour Dressing ",2.5
5481,Scandinavian Yellow Pea Soup ,4.375
5482,Caraway Cabbage Chips with Dill Yogurt ,2.5
5483,Sautéed Green Beans and Brussels Sprouts with Chile and Mint ,4.375
5484,Roast Chicken with Maple-Soy Glaze ,4.375
5485,Toast with Tomato-Butter and Marjoram ,0.0
5486,"Mixed Citrus ""Marmalade"" ",5.0
5487,Rib Eye Roast ,3.75
5488,Mussels with Shallots and Tarragon ,2.5
5489,Lemon Crème Brûlée Tart ,4.375
5490,Wine-Braised Ham with Shallots and Carrots ,4.375
5491,Meyer Lemon Budino ,5.0
5492,Agave Margarita ,4.375
5493,Mexican Sandwiches ,4.375
5494,"Grilled Chicken with Goat Cheese Stuffing, Peppers, Onions and Two Salsas ",3.75
5495,"Celery Root, Radish, and Watercress Salad with Mustard Seed Dressing ",3.75
5496,Blood Orange Roast Pork Loin ,4.375
5497,Rice with Soy-Glazed Bonito Flakes and Sesame Seeds ,4.375
5498,Pickled Napa Cabbage ,0.0
5499,Quick-Pickled Carrots ,0.0
5500,Tagliatelle with Zucchini and Shrimp ,3.125
5501,Celery Seed Dressing ,3.75
5502,"Salmon Salad with Fennel, Orange, and Mint ",4.375
5503,Lemon Pasta with Chicken and Pine Nuts ,3.75
5504,Cornmeal Biscuits with Chorizo Gravy and Scallions ,4.375
5505,"Roasted Sausages, Apples, and Cabbage with Caraway ",3.125
5506,Apple Galette ,4.375
5507,Poulet aux Citrons Confits et Olives ,3.75
5508,Pistachio Meringues ,4.375
5509,Pasta with Fresh Tomato-Herb Sauce ,3.75
5510,"Sauteed Chicken with Parsnip, Apple, and Sherry Pan Sauce ",3.75
5511,Linguine with Pears and Gorgonzola Cheese ,4.375
5512,Fresh Blackberry Napoleons with Cream Cheese Mousse ,4.375
5513,Thyme-Toasted Almonds ,4.375
5514,Grilled Tea-Brined Turkey with Tea-and-Lemon Gravy ,5.0
5515,Fried Mozzarella Skewers ,5.0
5516,Red Pepper Sauce ,3.75
5517,Sauteed Mushrooms with Lemon Cream ,4.375
5518,Strawberry-Cucumber Salad with Lemon Cream ,5.0
5519,Garlic and Sage Marinated Antipasto ,3.75
5520,Pineapple and Banana Couscous Pudding ,3.125
5521,Cardamom Chai ,3.75
5522,Banana Gratins ,2.5
5523,Blender Mayonnaise ,3.75
5524,Turkish Grilled Turkey or Chicken with Tangy Herbed Yogurt ,0.0
5525,Cornish Game Hen with Stuffing and Sherried Gravy ,4.375
5526,Merveilles ,0.0
5527,Berry Napoleons ,3.75
5528,Grilled Korean-Style Short Ribs ,4.375
5529,Parmesan Bread Pudding with Broccoli Rabe and Pancetta ,4.375
5530,Frittata with Mustard Greens and Fontina ,3.75
5531,"Potato, Caramelized Onion, and Goat Cheese Gratin ",3.75
5532,Whole-Wheat Scones ,3.75
5533,Chicken Giblet Stock ,0.0
5534,Citrus-Brined Pork Loin with Peach Mustard ,5.0
5535,Vodka and Watermelon Cooler ,4.375
5536,Berry-Vodka Cooler ,0.0
5537,Salmon Burgers with Spinach and Ginger ,4.375
5538,Crazy Cantina Chili ,3.75
5539,Classic Mayonnaise ,5.0
5540,Crispy Fried Shallots ,4.375
5541,Blue Plate Special Meat Loaf ,3.75
5542,Coconut Rum Cake ,4.375
5543,Twice-Baked Almond Cookies ,3.75
5544,Grilled Chicken with Roasted Tomato and Oregano Salsa ,3.75
5545,Apple Chips ,3.125
5546,Nachos ,1.25
5547,Feta and Mint Rice ,4.375
5548,Sticky Spicy Ribs ,4.375
5549,Vegetable Ragoût ,5.0
5550,Frozen Raspberry Zabaglione on Meringues with Chocolate Sauce ,3.75
5551,Creamy Grits with Rosemary Bacon ,4.375
5552,Beef Pasties with Caramelized Onions and Stilton Cheese ,3.75
5553,Candied Walnuts ,4.375
5554,Rib-Eye Steaks with Bell Peppers and Gorgonzola Butter ,4.375
5555,Deviled Potato Salad ,4.375
5556,Fresh Homemade Ricotta ,5.0
5557,Three-Berry Pie with Vanilla Cream ,5.0
5558,,-1.0
5559,Spinach Salad with Tamarind Dressing and Pappadam Croutons ,3.125
5560,Wee Gazpacho ,0.0
5561,Roasted Tomato and Herb Tart ,4.375
5562,Apple-Cranberry Crisp ,4.375
5563,Sesame Carrots ,3.75
5564,Avocado Salsa ,3.75
5565,Bacon-Wrapped Trout ,2.5
5566,Grilled Chicken Breast Stuffed with Prosciutto and Basil ,4.375
5567,Piña Colada Pie ,4.375
5568,Cream Cheese Crostata with Orange Marmalade ,5.0
5569,"Banana, Raspberry, and Granola Yogurt ",3.75
5570,Cajeta Flan ,4.375
5571,Tossed Fresh Fruit Salad with Orange Mayonnaise Dressing ,0.0
5572,"Grilled Scallop ""Ceviche"" ",5.0
5573,Five-Spice Roasted Guinea Hens ,3.75
5574,Overnight Pizza Dough ,5.0
5575,Melon and Berry Compote ,4.375
5576,Cabbage and Corn Slaw with Cilantro and Orange Dressing ,4.375
5577,Turkey Mole ,3.75
5578,Tortellini with Chicken and Pesto ,3.75
5579,Thai Tea Pudding with Lime Caramel and Candied Cashews ,4.375
5580,Pork Tenderloin Cubano ,4.375
5581,Farmhouse Herbed Stuffing ,4.375
5582,"Spaghetti with Cauliflower, Green Olives, and Almonds ",4.375
